{
  "$schema": "https://json-schema.org/draft/2020-12/schema",
  "type": "object",
  "properties": {
    "id": {
      "type": "string",
      "minLength": 1
    },
    "name": {
      "type": "string",
      "minLength": 1
    },
    "description": {
      "type": "string",
      "minLength": 1
    },
    "executionMode": {
      "type": "string",
      "const": "REACTIVE"
    },
    "agentId": {
      "type": "string",
      "const": ""
    },
    "termination": {
      "type": "object",
      "properties": {
        "type": {
          "type": "string"
        }
      },
      "required": [
        "type"
      ],
      "additionalProperties": {}
    },
    "goals": {
      "type": "array",
      "items": {}
    },
    "pacingPreset": {
      "type": "string"
    },
    "scanConfig": {
      "type": "object",
      "properties": {},
      "additionalProperties": {}
    }
  },
  "required": [
    "id",
    "name",
    "description",
    "termination",
    "goals"
  ],
  "additionalProperties": {}
}
